{
  "schema": "ld-s10y-image/figure-spec@1",
  "id": "tbl-p0025-01",
  "mode": "deterministic",
  "description": "A five-year table of electricity output values.",
  "source": {
    "image": {
      "path": "resources/s10y-lessons/5m/figures/tbl-p0025-01.png",
      "sha256": "f7ada433d755660aa99bb9ecc42107e3e94d1c3233a010056824b28e494c213c"
    },
    "authoritativeText": [
      {
        "lesson": "math5-c1-s1-n5",
        "text": "图 16"
      }
    ]
  },
  "canvas": {
    "width": 1024,
    "height": 626,
    "boundingBox": [
      0,
      220.0,
      360.0,
      0
    ],
    "background": "#ffffff",
    "keepAspectRatio": true
  },
  "palette": {
    "primary": "#0f8b8d",
    "secondary": "#58a942",
    "ink": "#172526",
    "grid": "#9acfd0"
  },
  "objects": [
    {
      "id": "polygon-1",
      "type": "polygon",
      "points": [
        [
          15.0,
          175.0
        ],
        [
          345.0,
          175.0
        ],
        [
          345.0,
          55.0
        ],
        [
          15.0,
          55.0
        ]
      ],
      "stroke": "primary",
      "strokeWidth": 5.688888888888889,
      "opacity": 1,
      "fill": "none",
      "fillOpacity": 0
    },
    {
      "id": "segment-1",
      "type": "segment",
      "from": [
        15.0,
        115.0
      ],
      "to": [
        345.0,
        115.0
      ],
      "stroke": "primary",
      "strokeWidth": 5.688888888888889,
      "opacity": 1
    },
    {
      "id": "segment-2",
      "type": "segment",
      "from": [
        81.0,
        175.0
      ],
      "to": [
        81.0,
        55.0
      ],
      "stroke": "primary",
      "strokeWidth": 5.688888888888889,
      "opacity": 1
    },
    {
      "id": "segment-3",
      "type": "segment",
      "from": [
        147.0,
        175.0
      ],
      "to": [
        147.0,
        55.0
      ],
      "stroke": "primary",
      "strokeWidth": 5.688888888888889,
      "opacity": 1
    },
    {
      "id": "segment-4",
      "type": "segment",
      "from": [
        213.0,
        175.0
      ],
      "to": [
        213.0,
        55.0
      ],
      "stroke": "primary",
      "strokeWidth": 5.688888888888889,
      "opacity": 1
    },
    {
      "id": "segment-5",
      "type": "segment",
      "from": [
        279.0,
        175.0
      ],
      "to": [
        279.0,
        55.0
      ],
      "stroke": "primary",
      "strokeWidth": 5.688888888888889,
      "opacity": 1
    },
    {
      "id": "text-1",
      "type": "text",
      "at": [
        48.0,
        138.0
      ],
      "text": "1970",
      "fontSize": 31.28888888888889,
      "fontWeight": 600,
      "labelColor": "ink",
      "textAnchor": "middle",
      "dominantBaseline": "alphabetic",
      "labelPlacement": {
        "position": "CENTER",
        "fallback": true
      }
    },
    {
      "id": "text-2",
      "type": "text",
      "at": [
        114.0,
        138.0
      ],
      "text": "1971",
      "fontSize": 31.28888888888889,
      "fontWeight": 600,
      "labelColor": "ink",
      "textAnchor": "middle",
      "dominantBaseline": "alphabetic",
      "labelPlacement": {
        "position": "CENTER",
        "fallback": true
      }
    },
    {
      "id": "text-3",
      "type": "text",
      "at": [
        180.0,
        138.0
      ],
      "text": "1972",
      "fontSize": 31.28888888888889,
      "fontWeight": 600,
      "labelColor": "ink",
      "textAnchor": "middle",
      "dominantBaseline": "alphabetic",
      "labelPlacement": {
        "position": "CENTER",
        "fallback": true
      }
    },
    {
      "id": "text-4",
      "type": "text",
      "at": [
        246.0,
        138.0
      ],
      "text": "1973",
      "fontSize": 31.28888888888889,
      "fontWeight": 600,
      "labelColor": "ink",
      "textAnchor": "middle",
      "dominantBaseline": "alphabetic",
      "labelPlacement": {
        "position": "CENTER",
        "fallback": true
      }
    },
    {
      "id": "text-5",
      "type": "text",
      "at": [
        312.0,
        138.0
      ],
      "text": "1974",
      "fontSize": 31.28888888888889,
      "fontWeight": 600,
      "labelColor": "ink",
      "textAnchor": "middle",
      "dominantBaseline": "alphabetic",
      "labelPlacement": {
        "position": "CENTER",
        "fallback": true
      }
    },
    {
      "id": "text-6",
      "type": "text",
      "at": [
        48.0,
        78.0
      ],
      "text": "741",
      "fontSize": 31.28888888888889,
      "fontWeight": 600,
      "labelColor": "ink",
      "textAnchor": "middle",
      "dominantBaseline": "alphabetic",
      "labelPlacement": {
        "position": "CENTER",
        "fallback": true
      }
    },
    {
      "id": "text-7",
      "type": "text",
      "at": [
        114.0,
        78.0
      ],
      "text": "800",
      "fontSize": 31.28888888888889,
      "fontWeight": 600,
      "labelColor": "ink",
      "textAnchor": "middle",
      "dominantBaseline": "alphabetic",
      "labelPlacement": {
        "position": "CENTER",
        "fallback": true
      }
    },
    {
      "id": "text-8",
      "type": "text",
      "at": [
        180.0,
        78.0
      ],
      "text": "857",
      "fontSize": 31.28888888888889,
      "fontWeight": 600,
      "labelColor": "ink",
      "textAnchor": "middle",
      "dominantBaseline": "alphabetic",
      "labelPlacement": {
        "position": "CENTER",
        "fallback": true
      }
    },
    {
      "id": "text-9",
      "type": "text",
      "at": [
        246.0,
        78.0
      ],
      "text": "915",
      "fontSize": 31.28888888888889,
      "fontWeight": 600,
      "labelColor": "ink",
      "textAnchor": "middle",
      "dominantBaseline": "alphabetic",
      "labelPlacement": {
        "position": "CENTER",
        "fallback": true
      }
    },
    {
      "id": "text-10",
      "type": "text",
      "at": [
        312.0,
        78.0
      ],
      "text": "975",
      "fontSize": 31.28888888888889,
      "fontWeight": 600,
      "labelColor": "ink",
      "textAnchor": "middle",
      "dominantBaseline": "alphabetic",
      "labelPlacement": {
        "position": "CENTER",
        "fallback": true
      }
    }
  ],
  "assertions": [
    {
      "type": "objectCount",
      "objectType": "polygon",
      "count": 1
    },
    {
      "type": "objectCount",
      "objectType": "segment",
      "count": 5
    },
    {
      "type": "objectCount",
      "objectType": "text",
      "count": 10
    }
  ],
  "layout": {
    "minLabelGap": 2,
    "avoidRegions": []
  },
  "review": {
    "status": "pass",
    "notes": "Mathematical relationships, labels, counts, clipping, and cultural neutrality verified against the edition text and source composition."
  }
}
