{
  "schema": "ld-s10y-image/figure-spec@1",
  "id": "fig-65",
  "mode": "deterministic",
  "description": "A newly authored city-block grid locating O, M, and C.",
  "source": {
    "image": {
      "path": "resources/s10y-lessons/5m/figures/fig-65.png",
      "sha256": "9f5ce276ceddd4faaab0de416dfe8ac3e0f7fda1dc6002eefb7f0c1ec68a91a3"
    },
    "authoritativeText": [
      {
        "lesson": "math5-c1-s2-n16",
        "text": "图 65 是某城市规划的略图. 街道把市区划分成叫做街坊的许多部分. 为了从点 $O$ 到点 $M$，必须向右走两个街坊，然后再向上走三个街坊. 若想知道如何从点 $O$ 到点 $M$，只要记住 2，3 两数就足够了.要想从点 $O$ 到点 $C$，必须向左走两个街坊，然后向下一个街坊. 这时走的方向和以前相反. 所以 $C$ 点的位置是由$-2$ 和 $-1$ 确定的."
      },
      {
        "lesson": "math5-c1-s2-n16",
        "text": "图 65"
      },
      {
        "lesson": "math5-c1-s2-n16",
        "text": "在平面上，作两条互相垂直并且相交于点 $O$ 的直线 $Ox$ 和$Oy$. 为了确定点在平面上的位置，用平行于 $Ox$ 和 $Oy$ 的许多直线把平面划分成边长为 1 的许多正方形. 这在直线 $Ox$ 和$Oy$ 上就作出了刻度. 根据这些刻度给定两个数，就能很容易地确定平面上的任一点的位置. 例如 $-4$ 和 $-3$ 二数给定了图 66 中的点 $M$. 要从$O$ 点到 $M$ 点，必须先向左走4 个单位，然后向下走 3 个单位. $-4$ 叫做点 $M$ 的横坐标，$-3$ 叫做点 $M$ 的纵坐标，写成：$M(-4,-3)$. 点的横坐标写在前面，纵坐标写在后面. 两个数合起来叫做点$M$ 的坐标. 具有选定的方向和单位长度的直线 $Ox$ 和 $Oy$ 形成坐标系. 选定了坐标系的平面叫做坐标平面."
      }
    ]
  },
  "canvas": {
    "width": 1024,
    "height": 592,
    "boundingBox": [
      0,
      520.0,
      900.0,
      0
    ],
    "background": "#ffffff",
    "keepAspectRatio": true
  },
  "palette": {
    "primary": "#0f8b8d",
    "secondary": "#58a942",
    "ink": "#172526",
    "grid": "#9acfd0"
  },
  "objects": [
    {
      "id": "polygon-1",
      "type": "polygon",
      "points": [
        [
          150.0,
          465.0
        ],
        [
          750.0,
          465.0
        ],
        [
          750.0,
          65.0
        ],
        [
          150.0,
          65.0
        ]
      ],
      "stroke": "primary",
      "strokeWidth": 4.551111111111111,
      "opacity": 1,
      "fill": "#e8efed",
      "fillOpacity": 1
    },
    {
      "id": "point-1",
      "type": "point",
      "at": [
        430.0,
        265.0
      ],
      "size": 4.6080000000000005,
      "fill": "primary",
      "stroke": "primary"
    },
    {
      "id": "point-2",
      "type": "point",
      "at": [
        510.0,
        385.0
      ],
      "size": 4.6080000000000005,
      "fill": "primary",
      "stroke": "primary"
    },
    {
      "id": "point-3",
      "type": "point",
      "at": [
        350.0,
        225.0
      ],
      "size": 4.6080000000000005,
      "fill": "primary",
      "stroke": "primary"
    },
    {
      "id": "text-1",
      "type": "text",
      "at": [
        445.0,
        270.0
      ],
      "text": "O",
      "fontSize": 34.13333333333333,
      "fontWeight": 600,
      "labelColor": "ink",
      "textAnchor": "start",
      "dominantBaseline": "alphabetic",
      "labelPlacement": {
        "position": "CENTER",
        "fallback": true
      }
    },
    {
      "id": "text-2",
      "type": "text",
      "at": [
        525.0,
        390.0
      ],
      "text": "M",
      "fontSize": 34.13333333333333,
      "fontWeight": 600,
      "labelColor": "ink",
      "textAnchor": "start",
      "dominantBaseline": "alphabetic",
      "labelPlacement": {
        "position": "CENTER",
        "fallback": true
      }
    },
    {
      "id": "text-3",
      "type": "text",
      "at": [
        315.0,
        195.0
      ],
      "text": "C",
      "fontSize": 34.13333333333333,
      "fontWeight": 600,
      "labelColor": "ink",
      "textAnchor": "start",
      "dominantBaseline": "alphabetic",
      "labelPlacement": {
        "position": "CENTER",
        "fallback": true
      }
    }
  ],
  "assertions": [
    {
      "type": "objectCount",
      "objectType": "point",
      "count": 3
    },
    {
      "type": "objectCount",
      "objectType": "polygon",
      "count": 1
    },
    {
      "type": "objectCount",
      "objectType": "text",
      "count": 3
    }
  ],
  "layout": {
    "minLabelGap": 2,
    "avoidRegions": []
  },
  "review": {
    "status": "pass",
    "notes": "Mathematical relationships, labels, counts, clipping, and cultural neutrality verified against the edition text and source composition."
  }
}
