{
  "schema": "ld-s10y-image/figure-spec@1",
  "id": "fig-19",
  "mode": "deterministic",
  "description": "A triangle with three acute angles.",
  "source": {
    "image": {
      "path": "resources/s10y-lessons/5m/figures/fig-19.png",
      "sha256": "99f65cbd925509fe132921f812b086f7f8002d9446a7346dfd5742cc48b92c64"
    },
    "authoritativeText": [
      {
        "lesson": "math5-c1-s1-n6",
        "text": "三角形可按它的角的大小进行分类.三角形中只能有一个直角或一个钝角，否则，三个内角的和就要大于 $180^\\circ$. 所以各种三角形的集合可以按角的大小分成三类：1) 锐角三角形，三个角都是锐角（图 19）；2) 直角三角形，有一个直角（图 20）；3) 钝角三角形，有一个钝角（图 21）."
      },
      {
        "lesson": "math5-c1-s1-n6",
        "text": "图 19"
      },
      {
        "lesson": "math5-c1-s1-n6",
        "text": "图 20"
      }
    ]
  },
  "canvas": {
    "width": 1024,
    "height": 626,
    "boundingBox": [
      0,
      220.0,
      360.0,
      0
    ],
    "background": "#ffffff",
    "keepAspectRatio": true
  },
  "palette": {
    "primary": "#0f8b8d",
    "secondary": "#58a942",
    "ink": "#172526",
    "grid": "#9acfd0"
  },
  "objects": [
    {
      "id": "polygon-1",
      "type": "polygon",
      "points": [
        [
          70.0,
          45.0
        ],
        [
          180.0,
          185.0
        ],
        [
          300.0,
          45.0
        ]
      ],
      "stroke": "primary",
      "strokeWidth": 5.688888888888889,
      "opacity": 1,
      "fill": "none",
      "fillOpacity": 0
    }
  ],
  "assertions": [
    {
      "type": "objectCount",
      "objectType": "polygon",
      "count": 1
    }
  ],
  "layout": {
    "minLabelGap": 2,
    "avoidRegions": []
  },
  "review": {
    "status": "pass",
    "notes": "Mathematical relationships, labels, counts, clipping, and cultural neutrality verified against the edition text and source composition."
  }
}
